{"$schema":"https://json-schema.org/draft/2020-12/schema","type":"object","additionalProperties":false,"required":["schema_version","campaign","world_run_id","timezone","policy_version","m11_terminal_hash","Customer","Product","RFQ","Project","frames"],"properties":{"schema_version":{"const":"1.0"},"campaign":{"const":"industrialization"},"world_run_id":{"type":"string"},"timezone":{"const":"Asia/Shanghai"},"policy_version":{"const":"industrialization-policy-v1"},"m11_terminal_hash":{"pattern":"^sha256:","type":"string"},"Customer":{"const":"CUST-SGNEV"},"Product":{"const":"HCTM-BCP-A01"},"RFQ":{"type":"string"},"Project":{"type":"string"},"frames":{"type":"array","minItems":11}}}
