{"schema_version":"1.0","campaign":"industrialization","world_run_id":"world-run-genesis-industrialization-001","timezone":"Asia/Shanghai","policy_version":"industrialization-policy-v1","m11_terminal_hash":"sha256:m11-capability-terminal","Customer":"CUST-SGNEV","Product":"HCTM-BCP-A01","RFQ":"RFQ-SGNEV-BCP-A01-01","Project":"PROJECT-SGNEV-BCP-A01","frames":[{},{},{},{},{},{},{},{},{},{},{}]}
